<?xml version="1.0" encoding="UTF-8"?>
<!--
ldrewe : 0.90 : demo database for the lecture on Linux Days 2014/Berlin 
(C) Karsten Reincke, Deutsche Telekom AG, Darmstadt 2014 

A psiKeds knowledge base: developed for being used by the inference machine
of psiKeds, the purpose system induced knowledge entity delivery system
http://www.psikeds.org/) and generated by the psiKedsXtXKrl-Generator

This file is licensed under the conditions of a/the
CC-BY-SA-4.0

-->
<kb:knowledgebase xmlns="http://org.psikeds.knowledgebase"
  xmlns:kb="http://org.psikeds.knowledgebase"
  xmlns:xsi="http://www.w3.org/2001/XMLSchema-instance"
  xsi:schemaLocation="http://org.psikeds.knowledgebase kb.xsd">
  
  <kb:meta>
    <kb:created>2014-05-05T14:00:00</kb:created>
    <kb:lastmodified>2014-05-06T10:52:37</kb:lastmodified>
    <kb:creator>Karsten Reincke</kb:creator>
    <kb:description>Linux-Day-Rewe-Demo-Knowledgebase</kb:description>
  </kb:meta>
  
  <kb:data>  

    <kb:purposes>
      <kb:purpose id="relishDinner" root="true">
        <kb:label>relish.Dinner</kb:label>
      </kb:purpose>
      <kb:purpose id="addTaste" root="false">
        <kb:label>add:Taste</kb:label>
      </kb:purpose>
      <kb:purpose id="addVitamins" root="false">
        <kb:label>add:Vitamins</kb:label>
      </kb:purpose>
      <kb:purpose id="addProteins" root="false">
        <kb:label>add:Proteins</kb:label>
      </kb:purpose>
      <kb:purpose id="addCarbohydrats" root="false">
        <kb:label>add:Carbohydrats</kb:label>
      </kb:purpose>
    </kb:purposes>

    <kb:variants>
      <kb:variant id="VeggiMeal">
        <kb:label>Veggi Meal</kb:label>
      </kb:variant>

      <kb:variant id="CarniMeal">
        <kb:label>Carni Meal</kb:label>
      </kb:variant>

      <kb:variant id="Hollandaise">
        <kb:label>Sauce Hollandaise</kb:label>
      </kb:variant>

      <kb:variant id="BratenSosse">
        <kb:label>Bratenso√üe</kb:label>
      </kb:variant>

      <kb:variant id="Spargel">
        <kb:label>Spargel</kb:label>
      </kb:variant>

      <kb:variant id="Erbsen">
        <kb:label>Erbsen</kb:label>
      </kb:variant>

      <kb:variant id="Schinken">
        <kb:label>Schinken</kb:label>
      </kb:variant>

      <kb:variant id="Braten">
        <kb:label>Braten</kb:label>
      </kb:variant>

      <kb:variant id="Kartoffeln">
        <kb:label>Kartoffeln</kb:label>
      </kb:variant>

      <kb:variant id="Nudeln">
        <kb:label>Nudeln</kb:label>
      </kb:variant>

    </kb:variants>  

    <kb:alternatives>
      <kb:fulfills purposeID="relishDinner" variantID="VeggiMeal CarniMeal" />
      <kb:fulfills purposeID="addTaste" variantID="Hollandaise BratenSosse" />
      <kb:fulfills purposeID="addVitamins" variantID="Spargel Erbsen" />
      <kb:fulfills purposeID="addProteins" variantID="Braten Schinken" />
      <kb:fulfills purposeID="addCarbohydrats" variantID="Kartoffeln Nudeln" />
    </kb:alternatives>  

    <kb:constituents>
      <kb:constitutes variantID="VeggiMeal" purposeID="addTaste addVitamins addCarbohydrats" />
      <kb:constitutes variantID="CarniMeal" purposeID="addTaste addVitamins addProteins addCarbohydrats" />
    </kb:constituents> 


    <kb:events>

      <kb:event id="VeggiMealWithTasteX" variantID="VeggiMeal">
        <kb:label>Veggi Meal mit TasteX</kb:label>
        <kb:contextPath pathIDs="VeggiMeal addTaste" /> 
      </kb:event>
      <kb:event id="VeggiMealWithHollandaise" variantID="VeggiMeal">
        <kb:label>Veggi Meal mit Hollandaise</kb:label>
        <kb:contextPath pathIDs="VeggiMeal addTaste Hollandaise" /> 
      </kb:event>

      <kb:event id="VeggiMealWithVitaminX" variantID="VeggiMeal">
        <kb:label>Veggi Meal mit VitaminX</kb:label>      
        <kb:contextPath pathIDs="VeggiMeal addVitamins" /> 
       </kb:event>
      <kb:event id="VeggiMealWithSpargel" variantID="VeggiMeal">
        <kb:label>Veggi Meal mit Spargel</kb:label>      
        <kb:contextPath pathIDs="VeggiMeal addVitamins Spargel" /> 
       </kb:event>      
 
       <kb:event id="CarniMealWithTasteX" variantID="CarniMeal">
        <kb:label>Carni Meal mit TasteX</kb:label>
        <kb:contextPath pathIDs="CarniMeal addTaste" /> 
      </kb:event>
      <kb:event id="CarniMealWithHollandaise" variantID="CarniMeal">
        <kb:label>Carni Meal mit Hollandaise</kb:label>
        <kb:contextPath pathIDs="CarniMeal addTaste Hollandaise" /> 
      </kb:event>
 
      <kb:event id="CarniMealWithVitaminX" variantID="CarniMeal">
        <kb:label>Carni Meal mit VitaminX</kb:label>
        <kb:contextPath pathIDs="CarniMeal addVitamins" /> 
      </kb:event>       
      <kb:event id="CarniMealWithSpargel" variantID="CarniMeal">
        <kb:label>Carni Meal mit Spargel</kb:label>
        <kb:contextPath pathIDs="CarniMeal addVitamins Spargel" /> 
      </kb:event>

       <kb:event id="CarniMealWithProteinX" variantID="CarniMeal">
        <kb:label>Carni Meal mit ProteinX</kb:label>
        <kb:contextPath pathIDs="CarniMeal addProteins" /> 
      </kb:event>      
      <kb:event id="CarniMealWithSchinken" variantID="CarniMeal">
        <kb:label>Carni Meal mit Schinken</kb:label>
        <kb:contextPath pathIDs="CarniMeal addProteins Schinken" /> 
      </kb:event>

      <kb:event id="CarniMealWithCarboX" variantID="CarniMeal">
        <kb:label>Carni Meal mit KohlehydratX</kb:label>
        <kb:contextPath pathIDs="CarniMeal addCarbohydrats" /> 
      </kb:event>      
      <kb:event id="CarniMealWithKartoffeln" variantID="CarniMeal">
        <kb:label>Carni Meal mit Kartoffeln</kb:label>
        <kb:contextPath pathIDs="CarniMeal addCarbohydrats Kartoffeln" /> 
      </kb:event>

      <kb:event id="VeggiMealWithCarboX" variantID="VeggiMeal">
        <kb:label>VeggiMeal mit KohlehydratX</kb:label>
        <kb:contextPath pathIDs="VeggiMeal addCarbohydrats" /> 
      </kb:event>
      
      <kb:event id="VeggiMealWithKartoffeln" variantID="VeggiMeal">
        <kb:label>VeggiMeal mit Kartoffeln</kb:label>
        <kb:contextPath pathIDs="VeggiMeal addCarbohydrats Kartoffeln" /> 
      </kb:event>
    </kb:events> 


    <kb:rules>

      <kb:rule 
        id="IFVMwithHoolandaiseTHENVMwithSpargel"
        variantID="VeggiMeal"
        triggerEventID="VeggiMealWithHollandaise"        
        premiseEventID="VeggiMealWithVitaminX"
        conclusionEventID="VeggiMealWithSpargel" >
        <kb:label>IF VM mit Hoolandaise THEN VM mit Spargel</kb:label>
      </kb:rule>

      <kb:rule 
        id="IFVMwithSpargelTHENVMwithHoolandaise"
        variantID="VeggiMeal"
        triggerEventID="VeggiMealWithSpargel"
        premiseEventID="VeggiMealWithTasteX"
        conclusionEventID="VeggiMealWithHollandaise" >
        <kb:label>IF VM mit Spargel THEN VM mit Hollandaise</kb:label>
      </kb:rule>

      <kb:rule 
        id="IFCMwithHoolandaiseTHENCMwithSpargel"
        variantID="CarniMeal"
        triggerEventID="CarniMealWithHollandaise"
        premiseEventID="CarniMealWithVitaminX"
        conclusionEventID="CarniMealWithSpargel" >
        <kb:label>IF CM mit Hoolandaise THEN CM mit Spargel</kb:label>
      </kb:rule>

      <kb:rule 
        id="IFCMwithSpargelTHENCMwithHoolandaise"
        variantID="CarniMeal"
        triggerEventID="CarniMealWithSpargel"
        premiseEventID="CarniMealWithTasteX"
        conclusionEventID="CarniMealWithHollandaise" >
        <kb:label>IF CM mit Spargel THEN CM mit Hollandaise</kb:label>
      </kb:rule>

      <kb:rule 
        id="IFCMwithSpargelTHENCMwithSchinken"
        variantID="CarniMeal"
        triggerEventID="CarniMealWithSpargel"
        premiseEventID="CarniMealWithProteinX"
        conclusionEventID="CarniMealWithSchinken" >
        <kb:label>IF CM mit Spargel THEN CM mit Schinken</kb:label>
      </kb:rule>

      <kb:rule 
        id="IFCMwithSpargelTHENCMwithKartoffeln"
        variantID="CarniMeal"
        triggerEventID="CarniMealWithSpargel"
        premiseEventID="CarniMealWithCarboX"
        conclusionEventID="CarniMealWithKartoffeln" >
        <kb:label>IF CM mit Spargel THEN CM mit Kartoffeln</kb:label>
      </kb:rule>

      <kb:rule 
        id="IFVMwithSpargelTHENVMwithKartoffeln"
        variantID="VeggiMeal"
        triggerEventID="VeggiMealWithSpargel"
        premiseEventID="VeggiMealWithCarboX"
        conclusionEventID="VeggiMealWithKartoffeln" >
        <kb:label>IF VM mit Spargel THEN VM mit Kartoffeln</kb:label>
      </kb:rule>
    </kb:rules> 

  </kb:data>    
</kb:knowledgebase>
